{
  "contractVersion": 1,
  "projects": [
    {
      "id": "22222222-2222-4222-8222-222222222222",
      "ownerId": "11111111-1111-4111-8111-111111111111",
      "title": "Studies in light",
      "createdAt": "2026-09-12T12:00:00Z"
    }
  ],
  "assets": [
    {
      "id": "33333333-3333-4333-8333-333333333333",
      "ownerId": "11111111-1111-4111-8111-111111111111",
      "filename": "study-01.svg",
      "mediaType": "image/svg+xml",
      "originalObjectKey": null,
      "width": 1600,
      "height": 1000,
      "rating": 0,
      "flag": "none",
      "favourite": false
    }
  ],
  "collections": [
    {
      "id": "44444444-4444-4444-8444-444444444444",
      "projectId": "22222222-2222-4222-8222-222222222222",
      "title": "First selection",
      "assetIds": ["33333333-3333-4333-8333-333333333333"]
    }
  ],
  "recipes": [
    {
      "schemaVersion": 1,
      "assetId": "33333333-3333-4333-8333-333333333333",
      "revision": 1,
      "exposure": 0,
      "contrast": 0,
      "saturation": 1,
      "temperature": null,
      "tint": 0,
      "sharpness": 0,
      "noiseReduction": 0,
      "crop": {
        "x": 0,
        "y": 0,
        "width": 1,
        "height": 1
      },
      "rotation": 0
    },
    {
      "schemaVersion": 1,
      "assetId": "33333333-3333-4333-8333-333333333333",
      "revision": 2,
      "exposure": 0.75,
      "contrast": 0.2,
      "saturation": 0.8,
      "temperature": 5500,
      "tint": 7,
      "sharpness": 0.4,
      "noiseReduction": 0.2,
      "crop": {
        "x": 0.1,
        "y": 0.2,
        "width": 0.6,
        "height": 0.5
      },
      "rotation": 90
    }
  ],
  "renditions": [
    {
      "id": "55555555-5555-4555-8555-555555555555",
      "assetId": "33333333-3333-4333-8333-333333333333",
      "recipeRevision": 1,
      "kind": "web",
      "objectKey": "fixtures/study-01.svg",
      "width": 1600,
      "height": 1000,
      "contentKey": "fixture-v1"
    }
  ],
  "publications": [
    {
      "id": "66666666-6666-4666-8666-666666666666",
      "ownerId": "11111111-1111-4111-8111-111111111111",
      "projectId": "22222222-2222-4222-8222-222222222222",
      "destination": "gallery",
      "title": "Studies in light",
      "slug": "studies-in-light",
      "status": "draft",
      "visibility": "public",
      "downloads": "none",
      "assetIds": ["33333333-3333-4333-8333-333333333333"],
      "coverAssetId": "33333333-3333-4333-8333-333333333333",
      "revision": 1
    }
  ]
}
